{"$schema":"https://raw.githubusercontent.com/Bitcadia/Authority/main/schemas/mod-registry-index-v1.schema.json","schemaVersion":1,"generatedAt":"2026-08-31T02:40:58.513Z","notice":"Live index of original-site patch URLs from Hylian Modding and named publishers. This catalog contains no ROM data. Patch files are not redistributed; clients fetch exact pinned artifacts from their original HTTPS URLs.","categoryDefinitions":[],"games":[{"base":{"name":"The Legend of Zelda: Ocarina of Time","variant":"USA","gameCode":"CZLE","normalizedCrc32":"CD16C529","normalizedSha256":"C916AB315FBE82A22169BFF13D6B866E9FDDC907461EB6B0A227B82ACDF5B506"},"list":{"documentType":"mod-registry-v1","url":"https://raw.githubusercontent.com/Bitcadia/Authority/main/sites/hylian/catalog/671acd8ac0398c41a7bbf70d11b41d84cff1da0bbc92887c66ee9bdd15ce0b58.json","sha256":"671acd8ac0398c41a7bbf70d11b41d84cff1da0bbc92887c66ee9bdd15ce0b58","size":27690,"entryCount":21,"allowRedirects":false},"picks":[{"category":"the-sequel","entryId":"hylian-zelda64_dawn_and_dusk","name":"Zelda 64: Dawn and Dusk","version":"2"},{"category":"the-dlc","entryId":"hylian-the_missing_link","name":"The Missing Link","version":"2.0"},{"category":"the-replacement","entryId":"hylian-new_master_quest","name":"New Master Quest","version":"2.9"},{"category":"the-experiment","entryId":"hylian-hero_of_law","name":"Hero of Law","version":"1.21"}]},{"base":{"name":"The Legend of Zelda: Majora's Mask","variant":"USA","gameCode":"NZSE","normalizedCrc32":"B428D8A7","normalizedSha256":"EFB1365B3AE362604514C0F9A1A2D11F5DC8688BA5BE660A37DEBF5E3BE43F2B"},"list":{"documentType":"mod-registry-v1","url":"https://raw.githubusercontent.com/Bitcadia/Authority/main/sites/hylian/catalog/08e3330fb0769e4734936524fd9046de539eef0ee28ddb7a34cd51a64dbff411.json","sha256":"08e3330fb0769e4734936524fd9046de539eef0ee28ddb7a34cd51a64dbff411","size":7311,"entryCount":5,"allowRedirects":false},"picks":[{"category":"the-dlc","entryId":"hylian-pumkin_tower","name":"Pumkin Tower","version":"1.1.1"},{"category":"the-replacement","entryId":"hylian-majoras_mask_master_quest","name":"Majora's Mask Master Quest","version":"1.2"},{"category":"the-experiment","entryId":"hylian-majoras_mask_chaos_edition","name":"Majora's Mask: Chaos Edition","version":"0.5.7"}]}]}
