{"$schema":"https://raw.githubusercontent.com/Bitcadia/Authority/main/schemas/mod-registry-index-v1.schema.json","schemaVersion":1,"generatedAt":"2026-08-28T00:08:50Z","notice":"Live index of original-site patch URLs for Smash Remix. This catalog contains no ROM data. Patch files are not redistributed; clients fetch them from the publisher's original HTTPS URLs.","categoryDefinitions":[],"games":[{"base":{"name":"Super Smash Bros.","variant":"USA","gameCode":"NALE","normalizedCrc32":"EB97929E","normalizedSha256":"15592E79D3C5295CEF4371D4992F0BD25BEC2102FC29644C93E682F7EA99EF3D"},"list":{"documentType":"mod-registry-v1","url":"https://raw.githubusercontent.com/Bitcadia/Authority/main/sites/smashremix/catalog/cabf8e7b85a444b3efaff8faeb7abfbf2b9b5a34ddf03ca016a1b2414f60174d.json","sha256":"cabf8e7b85a444b3efaff8faeb7abfbf2b9b5a34ddf03ca016a1b2414f60174d","size":1281,"entryCount":1,"allowRedirects":false},"picks":[{"category":"the-replacement","entryId":"smashremix-2.0.1-ntsc","name":"Smash Remix","version":"2.0.1"}]}]}
