{"$schema":"https://raw.githubusercontent.com/Bitcadia/Authority/main/schemas/mod-registry-index-v1.schema.json","schemaVersion":1,"generatedAt":"2026-08-28T18:26:27.007Z","notice":"Metadata-only backup of direct BPS releases indexed by Romhacking.com. Bitcadia does not redistribute patch or ROM bytes. Patch size and SHA-256 were not supplied by the upstream registry; BPS and output-ROM integrity checks still apply.","categoryDefinitions":[],"games":[{"base":{"name":"Super Mario 64","variant":"USA","gameCode":"NSME","normalizedCrc32":"3CE60709","normalizedSha256":"17CE077343C6133F8C9F2D6D6D9A4AB62C8CD2AA57C40AEA1F490B4C8BB21D91"},"list":{"documentType":"mod-registry-v1","url":"https://raw.githubusercontent.com/Bitcadia/Authority/main/sites/rhdc/catalog/60c9b984a4b2fc0f19b5312917243b2ae1581ad3af43eb359625b64ce8e71d6b.json","sha256":"60c9b984a4b2fc0f19b5312917243b2ae1581ad3af43eb359625b64ce8e71d6b","size":1783764,"entryCount":1526,"allowRedirects":false},"picks":[{"category":"the-sequel","entryId":"rhdc-660695d12f0650df5f8c3d71-1.1h2","name":"SM64: Decades Later","version":"1.1h2","outputSha1":"CD73EDFC90E10F57A36F91B14D79BFEB6E198468"},{"category":"the-dlc","entryId":"rhdc-655d0f251c26adfe7074dba8-sha1-c155a63dde03e2005acf9c71edf2d15f7fe9d341","name":"Wario's Hint Art","version":"sha1-c155a63dde03e2005acf9c71edf2d15f7fe9d341","outputSha1":"C155A63DDE03E2005ACF9C71EDF2D15F7FE9D341"},{"category":"the-replacement","entryId":"rhdc-5e209fb7ea2543645dc04264-1.02","name":"Super Mario Star Road","version":"1.02","outputSha1":"C5839548BB5437937730E59823E33F476304AED1"},{"category":"the-experiment","entryId":"rhdc-67abd8d4c8f605fd953ba8f4-sha1-1e2678ab53eb67ad36c498f6138f827b5de009a1","name":"BAZR","version":"sha1-1e2678ab53eb67ad36c498f6138f827b5de009a1","outputSha1":"1E2678AB53EB67AD36C498F6138F827B5DE009A1"}]}]}
