{"$schema":"https://raw.githubusercontent.com/Bitcadia/Authority/main/schemas/mod-registry-index-v1.schema.json","schemaVersion":1,"generatedAt":"2026-08-28T02:18:47Z","notice":"Live index of original-site BPS patch URLs for Super Mario 64 (USA). This catalog contains no ROM data. Patch files are not redistributed; clients fetch them from the publisher's original HTTPS URLs with allowRedirects false.","categoryDefinitions":[],"games":[{"base":{"name":"Super Mario 64","variant":"USA","gameCode":"NSME","normalizedCrc32":"3CE60709","normalizedSha256":"17CE077343C6133F8C9F2D6D6D9A4AB62C8CD2AA57C40AEA1F490B4C8BB21D91"},"list":{"documentType":"mod-registry-v1","url":"https://raw.githubusercontent.com/Bitcadia/Authority/main/sites/sm64/catalog/d3256268152f340a36ba6ff209a0fcc5ee20f64ac6cb2c00d05572246d1e30b4.json","sha256":"d3256268152f340a36ba6ff209a0fcc5ee20f64ac6cb2c00d05572246d1e30b4","size":15979,"entryCount":15,"allowRedirects":false},"picks":[]}]}
